{
  "content_sha256": "f4205ef9b8c3c2d039873faf654fc57753cdbbe056bac9fb4a9ca5919502bac8",
  "control": {
    "all_model_tokens": 305390,
    "arm_id": "D",
    "elapsed_seconds": 375.869,
    "hidden_status": "pass",
    "high_critical_findings": 0,
    "quality_score": 100.0,
    "quality_score_source": "mechanical-gates@0.1",
    "review_verdict": "PASS",
    "session_ids": [
      "019f552a-956d-77b0-b2ac-ebcffe50930d",
      "019f5527-7087-7e12-9444-65d582e059f5"
    ],
    "sol_tokens": 305390,
    "task_success": true,
    "usage_complete": true
  },
  "experiment": {
    "all_model_tokens": 363920,
    "arm_id": "C",
    "elapsed_seconds": 529.767,
    "hidden_status": "pass",
    "high_critical_findings": 0,
    "quality_score": 100.0,
    "quality_score_source": "mechanical-gates@0.1",
    "review_verdict": "PASS",
    "session_ids": [
      "019f552d-2e75-7190-8ced-a738ae81b401",
      "019f552a-59d2-7040-9375-2ee4e332749e",
      "019f5527-7555-7d32-ada8-2eb73455e55e"
    ],
    "sol_tokens": 70917,
    "task_success": true,
    "usage_complete": true
  },
  "experiment_id": "token-firewall-terra-route-002",
  "object_id": "pair_eval-04-canonical-query-terra",
  "pair_id": "eval-04-canonical-query-terra",
  "provenance": {
    "campaign_mode": "single",
    "control_record_sha256": "8291b632512ea83fb4873a3fde533c97b3df53faedef657394e58a7b1e31fa36",
    "experiment_record_sha256": [
      "c2b6fa4ba7ae3bafb5365f8d9ebbc03aa9584e8cd877d92be043cd77c1d00587"
    ],
    "normalizer_revision": "benchmark-to-pair@0.1",
    "source_run_ids": [
      "run_eval_04_d_001",
      "run_eval_04_c_001"
    ]
  },
  "risk": "medium",
  "schema": "token-firewall/evaluation-pair@0.1",
  "task_content_sha256": "b5c15beecb3d12ebb5f017c97b7d7c094a301d5887f292513633809b3d0203c8",
  "task_id": "T-EVAL-04",
  "task_type": "feature"
}
