{
  "content_sha256": "bcbaaf7b3dad06659d91ab69386c7acbd6d8d72a67f3222c6f738b8d7e777af4",
  "control": {
    "all_model_tokens": 338926,
    "arm_id": "D",
    "elapsed_seconds": 388.853,
    "hidden_status": "pass",
    "high_critical_findings": 0,
    "quality_score": 100.0,
    "quality_score_source": "mechanical-gates@0.1",
    "review_verdict": "PASS",
    "session_ids": [
      "019f5522-84d7-7b12-86db-79eba735f2b9",
      "019f551f-47f7-7a43-a3bf-5e58234c7756"
    ],
    "sol_tokens": 338926,
    "task_success": true,
    "usage_complete": true
  },
  "experiment": {
    "all_model_tokens": 401526,
    "arm_id": "C",
    "elapsed_seconds": 551.006,
    "hidden_status": "pass",
    "high_critical_findings": 0,
    "quality_score": 100.0,
    "quality_score_source": "mechanical-gates@0.1",
    "review_verdict": "PASS",
    "session_ids": [
      "019f551b-31cf-73b1-9927-607e7a409ea5",
      "019f5518-407f-7340-b8ce-94cae26cc4ff",
      "019f5515-6424-7a73-baa6-32deffa6961c"
    ],
    "sol_tokens": 96987,
    "task_success": true,
    "usage_complete": true
  },
  "experiment_id": "token-firewall-terra-route-002",
  "object_id": "pair_eval-03-duration-terra",
  "pair_id": "eval-03-duration-terra",
  "provenance": {
    "campaign_mode": "single",
    "control_record_sha256": "42b8b1eff50fdd027adccc27fca356891cc267c8c7503011cfdb91b4760fcc79",
    "experiment_record_sha256": [
      "da5e07212ffd63a3e740df8c070bf66b379de2a65ef094fe5644f566b438c952"
    ],
    "normalizer_revision": "benchmark-to-pair@0.1",
    "source_run_ids": [
      "run_eval_03_d_001",
      "run_eval_03_c_002"
    ]
  },
  "risk": "low",
  "schema": "token-firewall/evaluation-pair@0.1",
  "task_content_sha256": "7900bbcb8e52074124428ad015e03a0fe1bccdbd660f5291559d49be459959ec",
  "task_id": "T-EVAL-03",
  "task_type": "feature"
}
