{
  "content_sha256": "0b41c3b192e3230fbe45253f57b359d341a923ff3936fcc7a3e4346f595c37ec",
  "control": {
    "all_model_tokens": 289067,
    "arm_id": "D",
    "elapsed_seconds": 379.682,
    "hidden_status": "pass",
    "high_critical_findings": 0,
    "quality_score": 100.0,
    "quality_score_source": "mechanical-gates@0.1",
    "review_verdict": "PASS",
    "session_ids": [
      "019f5548-aa68-7691-9d3f-3b3c73b7c21a",
      "019f5545-18cc-7e12-9629-db3df12b2d7d"
    ],
    "sol_tokens": 289067,
    "task_success": true,
    "usage_complete": true
  },
  "experiment": {
    "all_model_tokens": 398974,
    "arm_id": "C",
    "elapsed_seconds": 513.984,
    "hidden_status": "pass",
    "high_critical_findings": 0,
    "quality_score": 100.0,
    "quality_score_source": "mechanical-gates@0.1",
    "review_verdict": "PASS",
    "session_ids": [
      "019f552c-b307-7ef0-983c-70572261df57",
      "019f552a-3b85-7ff1-b5e4-f52ad268f570",
      "019f5527-728a-7813-8e91-220609f242d0"
    ],
    "sol_tokens": 97649,
    "task_success": true,
    "usage_complete": true
  },
  "experiment_id": "token-firewall-terra-route-002",
  "object_id": "pair_eval-05-stable-unique-terra",
  "pair_id": "eval-05-stable-unique-terra",
  "provenance": {
    "campaign_mode": "single",
    "control_record_sha256": "d8ee4e9f523fc65a97b0b79f6de9c13e19b3f9f769e07e6757ccceebb6cac91e",
    "experiment_record_sha256": [
      "6ee1e0751874349b363fd6c456cc1de6d8249644e8b49f499520c937c8e530ed"
    ],
    "normalizer_revision": "benchmark-to-pair@0.1",
    "source_run_ids": [
      "run_eval_05_d_001",
      "run_eval_05_c_001"
    ]
  },
  "risk": "low",
  "schema": "token-firewall/evaluation-pair@0.1",
  "task_content_sha256": "c53d258d61a506908aee131e5795e85324e5b2c70f25da99a7a1521c6daeff6d",
  "task_id": "T-EVAL-05",
  "task_type": "refactor"
}
