{
  "content_sha256": "6fa3b3da123a1d2a172673f89473b862372a092bd71edb7ae3e0b1b3e6f6a1fa",
  "control": {
    "all_model_tokens": 327643,
    "arm_id": "D",
    "elapsed_seconds": 452.084,
    "hidden_status": "pass",
    "high_critical_findings": 0,
    "quality_score": 100.0,
    "quality_score_source": "mechanical-gates@0.1",
    "review_verdict": "PASS",
    "session_ids": [
      "019f5197-3a47-7d91-9619-6c166faa9cf3",
      "019f5192-edd6-70f0-a231-2f69a7045753"
    ],
    "sol_tokens": 327643,
    "task_success": true,
    "usage_complete": true
  },
  "experiment": {
    "all_model_tokens": 1304841,
    "arm_id": "A",
    "elapsed_seconds": 428.027,
    "hidden_status": "pass",
    "high_critical_findings": 0,
    "quality_score": 100.0,
    "quality_score_source": "mechanical-gates@0.1",
    "review_verdict": "PASS",
    "session_ids": [
      "mvs_6957816a130341b0a6b5363c03d2ee3c",
      "mvs_279ac9de83c6493792e7f46ef25dc641",
      "019f51a4-d5be-7702-8a3e-5f8061b1f08e"
    ],
    "sol_tokens": 100908,
    "task_success": true,
    "usage_complete": true
  },
  "experiment_id": "token-firewall-m3-route-002",
  "object_id": "pair_pilot-high-m3",
  "pair_id": "pilot-high-m3",
  "provenance": {
    "campaign_mode": "single",
    "control_record_sha256": "ec5c6e20f2965bc93f3da023033dd22cc290cba21383b80dc0ab682c70136a36",
    "experiment_record_sha256": [
      "7d252ca4c8d57bdabf6db9700210ef177936db66f706ad9b16fd777fe1fc03f3",
      "5e447822e834da2d000f4b87f212dc0d78955376260fa5ec0f216124290b0f59",
      "c88b43a84d465e93118be581b4f705d20b65878ef358376b745108b9845ba6ce"
    ],
    "failed_attempt_record_sha256": [
      "7d252ca4c8d57bdabf6db9700210ef177936db66f706ad9b16fd777fe1fc03f3",
      "5e447822e834da2d000f4b87f212dc0d78955376260fa5ec0f216124290b0f59"
    ],
    "normalizer_revision": "benchmark-to-pair@0.2",
    "source_run_ids": [
      "run_pilot_high_d_004",
      "run_pilot_high_a_004",
      "run_pilot_high_a_006",
      "run_pilot_high_a_007"
    ]
  },
  "risk": "high",
  "schema": "token-firewall/evaluation-pair@0.1",
  "task_content_sha256": "ac88c5c02ad46fb2807c8b236c52c386371b89155b54f4ef78f0420188db009f",
  "task_id": "T-PILOT-HIGH",
  "task_type": "bugfix"
}
