{
  "content_sha256": "a6e355d723d64aa64da9d8f9c0f60d770b490dff4cdc0fd1f71d5db3103fdc77",
  "control": {
    "all_model_tokens": 274857,
    "arm_id": "D",
    "elapsed_seconds": 351.911,
    "hidden_status": "pass",
    "high_critical_findings": 0,
    "quality_score": 100.0,
    "quality_score_source": "mechanical-gates@0.1",
    "review_verdict": "PASS",
    "session_ids": [
      "019f5547-f648-7a22-8850-0f7eb388aaab",
      "019f5545-1d2f-7863-bbc7-a1a5a3e6a4ec"
    ],
    "sol_tokens": 274857,
    "task_success": true,
    "usage_complete": true
  },
  "experiment": {
    "all_model_tokens": 336364,
    "arm_id": "C",
    "elapsed_seconds": 490.284,
    "hidden_status": "pass",
    "high_critical_findings": 0,
    "quality_score": 100.0,
    "quality_score_source": "mechanical-gates@0.1",
    "review_verdict": "PASS",
    "session_ids": [
      "019f5536-9f01-7d93-a625-36093464296b",
      "019f5533-f24f-75c1-952b-9d48a703c7ad",
      "019f5531-6aba-7e10-a944-39f3837e19e5"
    ],
    "sol_tokens": 70583,
    "task_success": true,
    "usage_complete": true
  },
  "experiment_id": "token-firewall-terra-route-002",
  "object_id": "pair_eval-07-pagination-terra",
  "pair_id": "eval-07-pagination-terra",
  "provenance": {
    "campaign_mode": "single",
    "control_record_sha256": "f33a290ec4f7fea484decaa603d3e1c65c7938d6e5fb18b4ee73e5ba39185ab4",
    "experiment_record_sha256": [
      "6083d871fc4cab160043a69f6441ac7ab7a6e49c77b97dc6926dd3faf92a333f"
    ],
    "normalizer_revision": "benchmark-to-pair@0.1",
    "source_run_ids": [
      "run_eval_07_d_001",
      "run_eval_07_c_001"
    ]
  },
  "risk": "medium",
  "schema": "token-firewall/evaluation-pair@0.1",
  "task_content_sha256": "6cd5509c90bea8ebf821659a87c276e0cc67d7287d46baf59f77fb7eb632a941",
  "task_id": "T-EVAL-07",
  "task_type": "integration"
}
