{
  "content_sha256": "9bb614a8d616a38f068d6c1346739690dc5de2cc9f1d2231d7663fed09f6a30a",
  "control": {
    "all_model_tokens": 327643,
    "arm_id": "D",
    "elapsed_seconds": 452.084,
    "hidden_status": "pass",
    "high_critical_findings": 0,
    "quality_score": 100.0,
    "quality_score_source": "mechanical-gates@0.1",
    "review_verdict": "PASS",
    "session_ids": [
      "019f5197-3a47-7d91-9619-6c166faa9cf3",
      "019f5192-edd6-70f0-a231-2f69a7045753"
    ],
    "sol_tokens": 327643,
    "task_success": true,
    "usage_complete": true
  },
  "experiment": {
    "all_model_tokens": 375286,
    "arm_id": "C",
    "elapsed_seconds": 598.664,
    "hidden_status": "pass",
    "high_critical_findings": 0,
    "quality_score": 100.0,
    "quality_score_source": "mechanical-gates@0.1",
    "review_verdict": "PASS",
    "session_ids": [
      "019f51ae-ce01-74a1-b4e8-2efc32fa6b94",
      "019f51ab-91fc-7c42-b7e3-7f25121d360c",
      "019f51a8-19ff-73a2-8a27-9ddb016a9f87"
    ],
    "sol_tokens": 72184,
    "task_success": true,
    "usage_complete": true
  },
  "experiment_id": "token-firewall-terra-route-002",
  "object_id": "pair_pilot-high-terra",
  "pair_id": "pilot-high-terra",
  "provenance": {
    "campaign_mode": "single",
    "control_record_sha256": "ec5c6e20f2965bc93f3da023033dd22cc290cba21383b80dc0ab682c70136a36",
    "experiment_record_sha256": [
      "3c1cda86a779f8526edc1dfd4f4e2a302b01126167f04cde3ffe22cc2b6e4458"
    ],
    "normalizer_revision": "benchmark-to-pair@0.1",
    "source_run_ids": [
      "run_pilot_high_d_004",
      "run_pilot_high_c_004"
    ]
  },
  "risk": "high",
  "schema": "token-firewall/evaluation-pair@0.1",
  "task_content_sha256": "ac88c5c02ad46fb2807c8b236c52c386371b89155b54f4ef78f0420188db009f",
  "task_id": "T-PILOT-HIGH",
  "task_type": "bugfix"
}
