{
  "content_sha256": "c74d2994a0d792f1d987c9b7edb8cfe7dde12c2293cf68389db139ad17e21acc",
  "control": {
    "all_model_tokens": 271282,
    "arm_id": "D",
    "elapsed_seconds": 162.361,
    "hidden_status": "pass",
    "high_critical_findings": 0,
    "quality_score": 100.0,
    "quality_score_source": "mechanical-gates@0.1",
    "review_verdict": "PASS",
    "session_ids": [
      "019f5165-ab1a-73e2-ae64-7ddd1c57a66a",
      "019f5152-e9a0-7843-acf0-87da04723216"
    ],
    "sol_tokens": 271282,
    "task_success": true,
    "usage_complete": true
  },
  "experiment": {
    "all_model_tokens": 346285,
    "arm_id": "C",
    "elapsed_seconds": 537.129,
    "hidden_status": "pass",
    "high_critical_findings": 0,
    "quality_score": 100.0,
    "quality_score_source": "mechanical-gates@0.1",
    "review_verdict": "PASS",
    "session_ids": [
      "019f5183-af64-7dd2-8e8f-b1d481a62507",
      "019f5180-e234-7b41-b022-4866ff2ce17f",
      "019f517e-2b54-76d2-b6f6-a7d362946803"
    ],
    "sol_tokens": 70128,
    "task_success": true,
    "usage_complete": true
  },
  "experiment_id": "token-firewall-terra-route-002",
  "object_id": "pair_pilot-low-terra-model-only",
  "pair_id": "pilot-low-terra-model-only",
  "provenance": {
    "campaign_mode": "single",
    "control_record_sha256": "b5309d29a1300857ce9388cf33467d0d243c12c4b719540a40bdfc087292a426",
    "experiment_record_sha256": [
      "9f80bc93d21dbdd1d4ec6af805a56098cb149cd793838de9cf26a7b9d9c59366"
    ],
    "normalizer_revision": "benchmark-to-pair@0.1",
    "source_run_ids": [
      "run_pilot_low_d_009",
      "run_pilot_low_c_004"
    ]
  },
  "risk": "low",
  "schema": "token-firewall/evaluation-pair@0.1",
  "task_content_sha256": "4a4cc1d50ff98ad29154ac8bd4c1b2c31a9eb4acfbacd01ae9d611ec7f89f53a",
  "task_id": "T-PILOT-LOW",
  "task_type": "bugfix"
}
