{
  "content_sha256": "30e12a4d57b10914279dfa90f89dcf39a128622be4df7277e5030007e0a49126",
  "control": {
    "all_model_tokens": 257061,
    "arm_id": "D",
    "elapsed_seconds": 315.945,
    "hidden_status": "pass",
    "high_critical_findings": 0,
    "quality_score": 100.0,
    "quality_score_source": "mechanical-gates@0.1",
    "review_verdict": "PASS",
    "session_ids": [
      "019f553e-86ec-7c13-8f3a-101895d82a85",
      "019f553b-ce78-7890-a892-e5177ebbf6f4"
    ],
    "sol_tokens": 257061,
    "task_success": true,
    "usage_complete": true
  },
  "experiment": {
    "all_model_tokens": 328138,
    "arm_id": "C",
    "elapsed_seconds": 494.724,
    "hidden_status": "pass",
    "high_critical_findings": 0,
    "quality_score": 100.0,
    "quality_score_source": "mechanical-gates@0.1",
    "review_verdict": "PASS",
    "session_ids": [
      "019f5524-9fca-7bc1-8c82-9416e18515a6",
      "019f5522-1301-70e3-b3b3-320cf985dabc",
      "019f551f-4c03-7b53-937c-8eb54c50ce83"
    ],
    "sol_tokens": 73765,
    "task_success": true,
    "usage_complete": true
  },
  "experiment_id": "token-firewall-terra-route-002",
  "object_id": "pair_eval-12-read-through-cache-terra",
  "pair_id": "eval-12-read-through-cache-terra",
  "provenance": {
    "campaign_mode": "single",
    "control_record_sha256": "5bdf569e1a73bc3cd5207d07dc0bb4e78a3894c47eab09d410a4c30a97e0ca28",
    "experiment_record_sha256": [
      "8b8a971d477fc6445ae3bf072c6e676cf09db3a3003f9d04750a246706ebe700"
    ],
    "normalizer_revision": "benchmark-to-pair@0.1",
    "source_run_ids": [
      "run_eval_12_d_001",
      "run_eval_12_c_001"
    ]
  },
  "risk": "medium",
  "schema": "token-firewall/evaluation-pair@0.1",
  "task_content_sha256": "25204825ce72b31b924ac4045e252039e5ecc220c399a28695799267d5982210",
  "task_id": "T-EVAL-12",
  "task_type": "integration"
}
