{
  "content_sha256": "a6381db77a0bb840896ab78269f295ca2b4232599daac1f763ab621411e659d3",
  "control": {
    "all_model_tokens": 327643,
    "arm_id": "D",
    "elapsed_seconds": 452.084,
    "hidden_status": "pass",
    "high_critical_findings": 0,
    "quality_score": 100.0,
    "quality_score_source": "mechanical-gates@0.1",
    "review_verdict": "PASS",
    "session_ids": [
      "019f5197-3a47-7d91-9619-6c166faa9cf3",
      "019f5192-edd6-70f0-a231-2f69a7045753"
    ],
    "sol_tokens": 327643,
    "task_success": true,
    "usage_complete": true
  },
  "experiment": {
    "all_model_tokens": 790011,
    "arm_id": "E",
    "elapsed_seconds": 251.19,
    "hidden_status": "not_run",
    "high_critical_findings": 0,
    "quality_score": 0.0,
    "quality_score_source": "mechanical-gates@0.1",
    "review_verdict": "not_run",
    "session_ids": [
      "1b80e80d-b173-442c-b642-9aa4b6d9b66b",
      "895fe3a6-5357-46b0-97f8-a05f1159c854"
    ],
    "sol_tokens": 0,
    "task_success": false,
    "usage_complete": false
  },
  "experiment_id": "token-firewall-claude-route-002",
  "object_id": "pair_pilot-high-claude",
  "pair_id": "pilot-high-claude",
  "provenance": {
    "campaign_mode": "single",
    "control_record_sha256": "ec5c6e20f2965bc93f3da023033dd22cc290cba21383b80dc0ab682c70136a36",
    "experiment_record_sha256": [
      "7b1aa0b36c230697c6af844398b5981bbfcc298995a81843ea909c5689fde0ba",
      "5a72eb6149e075688798d8b197f31dbe279d5d4ffcbc9b3c02c4f2604dbc8e80"
    ],
    "failed_attempt_record_sha256": [
      "7b1aa0b36c230697c6af844398b5981bbfcc298995a81843ea909c5689fde0ba"
    ],
    "normalizer_revision": "benchmark-to-pair@0.2",
    "source_run_ids": [
      "run_pilot_high_d_004",
      "run_pilot_high_e_004",
      "run_pilot_high_e_005"
    ]
  },
  "risk": "high",
  "schema": "token-firewall/evaluation-pair@0.1",
  "task_content_sha256": "ac88c5c02ad46fb2807c8b236c52c386371b89155b54f4ef78f0420188db009f",
  "task_id": "T-PILOT-HIGH",
  "task_type": "bugfix"
}
